{
  "schema_version": "trackai.security-activation-lease/2",
  "tenant_id": "tenant-placeholder",
  "machine_id": "machine-placeholder",
  "lease_id": "lease-placeholder",
  "issued_at": "2026-10-17T10:00:00Z",
  "expires_at": "2026-10-20T10:00:00Z",
  "mode": "monitor",
  "agents": ["claude-code"],
  "bundle_digest": "aaaaaaaaaaaaaaaaaaaaaaaaaaaaaaaaaaaaaaaaaaaaaaaaaaaaaaaaaaaaaaaa",
  "data_settings": {
    "schema_version": "trackai.security-data-settings/1",
    "command_previews": false,
    "file_paths": false,
    "urls": false,
    "host_identity": false,
    "user_identity": false
  },
  "day_one_scan": true
}
